{
  "schema_version":4,
  "run_id":"S_PALOD_k16_r0_337d3f57b4ddd7bf",
  "config_hash":"337d3f57b4ddd7bf",
  "case":"S",
  "method":"PALOD",
  "status":"success",
  "claim":"implementation-study",
  "stop_reason":"fixed H-step trajectory complete",
  "driver_state":"TrajectoryComplete",
  "error_evaluation_mode":"fixed-reference",
  "config":{"C0_usr":0.49135072057990814,"C1_usr":0.059576473311033412,"ambient_mesh":"reference-shadow","boundary_beta":1,"build_hash":"sha256:56f2da83f871a267cbb9bf139866f978218a0963c10c686921d9584c10020bb5","c_H":0.5,"case":"S","ell0":2,"ell_max":6,"git_commit":"89cf4b63cff78bb47c299f55ae528191358952f6","initial_coarse_level":5,"kernel_riesz_solver":"saddle_point","manuscript_sha256":"03d83e0eb7128aa5ef00002c6dac110f548351e52e92e56d7adf709880854d20","minimum_reference_level_gap":0,"method":"PALOD","patch_solver_kind":"direct_saddle","petrov_mode":"two_sided","plateau_diagnostic":{"maximum_relative_oscillation":0.14999999999999999,"minimum_geometric_mean_ratio":0.90000000000000002,"window_steps":2},"practical_stop_tolerance":0.01,"quadrature":{"base_triangle_order":7,"gaussian_triangle_order":10,"max_recursive_subdivisions":4,"singular_triangle_order":10},"reference_epoch":0,"reference_refresh_H_steps":[3,6,9],"reference_adequacy":{"enabled":false,"maximum_terminal_error_fraction":0.25,"refinement_levels":1},"reference_level":10,"reference_mesh":"uniform-nvb","relative_energy_targets":[0.10000000000000001,0.050000000000000003,0.02,0.01],"repeat_index":0,"rho_star":0.25,"schema_version":4,"theta_H":0.5,"theta_loc":0.19985934547160381,"timing_repeats":1,"trajectory_policy":"fixed_work_horizon","tolerances":{"eigen_relative_residual":1e-10,"interpolation_right_inverse":1.0000000000000001e-09,"linear_relative_residual":1e-10,"prolongation_composition":1e-10},"wavenumber":16,"work_limits":{"maximum_H_steps":12,"maximum_ambient_elements":4000000,"maximum_coarse_elements":300000,"maximum_iterations":260,"maximum_unknowns":4000000,"maximum_wall_seconds":43200}},
  "files":{"iterations":"iterations.csv","summary":"summary.csv","ell_history":"ell_history.csv","final_mesh":"final_mesh.vtu"},
  "convergence_diagnostic":{"status":"observed_stable_decay","distinct_points":13,"criterion":"last two positive error-vs-DOF log slopes differ by at most factor 2","previous_log_slope":1.6792632874590907,"last_log_slope":1.7286544449854386,"last_error_ratio":0.67205716655504844,"last_log_improvement":0.3974118727988275,"plateau_minimum_geometric_mean_ratio":0.90000000000000002,"plateau_maximum_relative_oscillation":0.14999999999999999,"plateau_window_steps":2,"window_geometric_mean_ratio":0.64643288665711029,"window_relative_oscillation":1.3930573942611113,"plateau_observed":false},
  "timing":{"method_seconds":116.26169488399999,"evaluation_reference_seconds":1.078255551,"evaluation_exact_seconds":7.6790666329999997,"evaluation_reference_excluded_from_method_time":true,"evaluation_exact_excluded_from_method_time":true,"reference_solution_cache_hit":false,"reference_solution_cache_key":"eac07ddf08b74a7a"},
  "hardware":{"hardware_threads":128,"compiler":"11.4.0","peak_memory_mb":2317.58984375}
}
