{
  "schema_version":4,
  "run_id":"S_AFEM_k16_r0_f8c83a05b5f7041a",
  "config_hash":"f8c83a05b5f7041a",
  "case":"S",
  "method":"AFEM",
  "status":"censored_work_limit",
  "claim":"implementation-study",
  "stop_reason":"adaptive FEM trajectory reached a configured work limit",
  "driver_state":"WorkLimitReached",
  "error_evaluation_mode":"manufactured-exact-only",
  "config":{"C0_usr":0.49135072057990814,"C1_usr":0.059576473311033412,"ambient_mesh":"reference-shadow","boundary_beta":1,"build_hash":"sha256:95365db723aca620be767d2bde29de9a1e392955f61456d892261730eca2be0d","c_H":0.5,"case":"S","ell0":0,"ell_max":0,"git_commit":"3ed802b82c788159d4bfe0c090eed008ff3a6cc2","initial_coarse_level":5,"kernel_riesz_solver":"saddle_point","manuscript_sha256":"03d83e0eb7128aa5ef00002c6dac110f548351e52e92e56d7adf709880854d20","minimum_reference_level_gap":0,"method":"AFEM","patch_solver_kind":"direct_saddle","petrov_mode":"two_sided","plateau_diagnostic":{"maximum_relative_oscillation":0.14999999999999999,"minimum_geometric_mean_ratio":0.90000000000000002,"window_steps":2},"practical_stop_tolerance":0.01,"quadrature":{"base_triangle_order":7,"gaussian_triangle_order":10,"max_recursive_subdivisions":4,"singular_triangle_order":10},"reference_epoch":0,"reference_adequacy":{"enabled":false,"maximum_terminal_error_fraction":0.25,"refinement_levels":1},"reference_level":18,"reference_mesh":"uniform-nvb","relative_energy_targets":[0.10000000000000001,0.050000000000000003,0.02,0.01],"repeat_index":0,"rho_star":0.25,"schema_version":4,"theta_H":0.5,"theta_loc":0.19985934547160381,"timing_repeats":1,"trajectory_policy":"fixed_work_horizon","tolerances":{"eigen_relative_residual":1e-10,"interpolation_right_inverse":1.0000000000000001e-09,"linear_relative_residual":1e-10,"prolongation_composition":1e-10},"wavenumber":16,"work_limits":{"maximum_H_steps":28,"maximum_ambient_elements":2000000,"maximum_coarse_elements":300000,"maximum_iterations":200,"maximum_unknowns":2000000,"maximum_wall_seconds":21600}},
  "files":{"iterations":"iterations.csv","summary":"summary.csv","ell_history":"ell_history.csv","final_mesh":"final_mesh.vtu"},
  "convergence_diagnostic":{"status":"insufficient_data","distinct_points":0,"criterion":"last two positive error-vs-DOF log slopes differ by at most factor 2","previous_log_slope":null,"last_log_slope":null,"last_error_ratio":null,"last_log_improvement":null,"plateau_minimum_geometric_mean_ratio":0.90000000000000002,"plateau_maximum_relative_oscillation":0.14999999999999999,"plateau_window_steps":2,"window_geometric_mean_ratio":null,"window_relative_oscillation":null,"plateau_observed":false},
  "timing":{"method_seconds":40.856173580000004,"evaluation_reference_seconds":0,"evaluation_exact_seconds":54.402690598,"evaluation_reference_excluded_from_method_time":true,"evaluation_exact_excluded_from_method_time":true,"reference_solution_cache_hit":false,"reference_solution_cache_key":"not-applicable"},
  "hardware":{"hardware_threads":128,"compiler":"11.4.0","peak_memory_mb":564.5703125}
}
